{
	"DeviceType":	1,
	"Switch":	1,
	"Mode":	0,
	"FanSpeed":	0,
	"TemperatureSetting":	26,
	"IndoorTemperature":	24,
	"SleepModeRemainingTime":	0,
	"ScheduleOn":	0,
	"ScheduleOff":	0,
	"MildewProof":	0,
	"QuickMode":	0,
	"PowerSaving":	0,
	"RemoteControlProhibit":	0,
	"ControlTone":	0,
	"PowerConsumption":	7,
	"TaiseiaError":	0,
	"FilterElapsedHour":	800,
	"CleanSwitch":	0,
	"CleanNotification":	0,
	"CleanStatus":	0,
	"WiFiSSID":	"<ssid>",
	"WiFiRSSI":	-22,
	"Error":	0,
	"RequestTimestamp":	1789574544,
	"ReceiveTimestamp":	1789574547,
	"Timestamp":	1789574548
}